,Title,URL,Comment Count,Unique Commenters,Upvotes,Engagement Score,Years Opened,Frustration Score
1467,AbortController exception in the wrong place and cannot be caught,https://github.com/nodejs/node/issues/55742,6,3,1,9.114549845083866,0.01642710472279261,7.758213552361396
876,Possible bug in fetch() receiving chunked response,https://github.com/nodejs/node/issues/47528,6,5,1,9.129645989067178,0.013689253935660506,7.756844626967831
362,armv7l package requires libatomic.so.1 since 12.16.0 but not documented,https://github.com/nodejs/node/issues/37219,6,4,0,6.086430659378119,0.013689253935660506,7.756844626967831
1400,Error Compiling Node.js v20.2.0  for Android (x86_64) using android-ndk-r25c,https://github.com/nodejs/node/issues/54919,6,3,0,6.086430659378119,0.013689253935660506,7.756844626967831
740,Weak Diffie-Hellman groups provided by crypto module,https://github.com/nodejs/node/issues/44539,6,4,0,6.0967792947570905,0.010951403148528405,7.755475701574264
347,test-crypto-secure-heap fails on IBM i,https://github.com/nodejs/node/issues/36929,6,4,0,6.0967792947570905,0.010951403148528405,7.755475701574264
885,performance.now() should jump after sleep/suspend/hibernation,https://github.com/nodejs/node/issues/47724,6,3,0,6.107424605770139,0.008213552361396304,7.7541067761806985
303,fs: inconsistent options treatment between rm() and rmdir(),https://github.com/nodejs/node/issues/35689,6,4,0,6.107424605770139,0.008213552361396304,7.7541067761806985
1402,fetch() throws uncatachable UND_ERR_SOCKET exception,https://github.com/nodejs/node/issues/54960,6,3,2,12.23675908154068,0.0054757015742642025,7.752737850787132
579,node -e invocation that doesn't mention sys yields deprecation warning,https://github.com/nodejs/node/issues/40871,6,3,0,6.11837954077034,0.0054757015742642025,7.752737850787132
1098,SIGINT is not handled when a short-lived process is run in watch-mode,https://github.com/nodejs/node/issues/51466,6,3,0,6.11837954077034,0.0054757015742642025,7.752737850787132
777,Tweak security disclaimer regarding legacy `url.parse`,https://github.com/nodejs/node/issues/45311,6,4,1,9.194486904570041,0.0027378507871321013,7.7513689253935665
1360,Re-order Node.js `src` directory 🥷,https://github.com/nodejs/node/issues/54363,6,3,0,6.1296579363800285,0.0027378507871321013,7.7513689253935665
1362,Allow shake128/256 to produce outputs of unlimited length,https://github.com/nodejs/node/issues/54406,6,3,0,6.1296579363800285,0.0027378507871321013,7.7513689253935665
905,Update previous versions to v8 to 11.3.244.4 (or apply one line fix),https://github.com/nodejs/node/issues/48250,6,3,0,6.1296579363800285,0.0027378507871321013,7.7513689253935665
1009,SourceTextModule leaks memory when context is used,https://github.com/nodejs/node/issues/50113,6,2,7,27.583460713710128,0.0027378507871321013,7.7513689253935665
255,FileHandle don't allow close while writing/reading,https://github.com/nodejs/node/issues/34716,6,2,0,6.141274602986215,0.0,7.75
1013,globalPreload docs have non-working code,https://github.com/nodejs/node/issues/50279,6,4,0,6.141274602986215,0.0,7.75
281,Proposal: reserve a top-level module for new experimental APIs,https://github.com/nodejs/node/issues/35289,6,3,0,6.141274602986215,0.0,7.75
1453,Freeze NODE_OPTIONS for SingeExecutableApplications,https://github.com/nodejs/node/issues/55573,6,3,2,12.28254920597243,0.0,7.75
1383,performance.getEntries and performance.getEntriesByName cause call stack size to be exceeded,https://github.com/nodejs/node/issues/54768,6,4,0,6.141274602986215,0.0,7.75
1309,EADDRINUSE error when trying to bind to port after it was closed,https://github.com/nodejs/node/issues/53738,6,3,1,9.21191190447932,0.0,7.75
270,doc: Buffer.prototype.byteLength is undocumented,https://github.com/nodejs/node/issues/34946,6,3,1,9.21191190447932,0.0,7.75
639,AbortSignal `abort` advice maybe needs clarification,https://github.com/nodejs/node/issues/42259,6,4,0,6.141274602986215,0.0,7.75
1073,armv7l libc don't have version `GLIBCXX_3.4.26' ,https://github.com/nodejs/node/issues/51233,6,4,0,6.141274602986215,0.0,7.75
476,stream: alternative async generator transform,https://github.com/nodejs/node/issues/39279,6,3,0,6.141274602986215,0.0,7.75
24,async_hooks.triggerAsyncId() don't return the expected value in context of the connection callback of net.Server,https://github.com/nodejs/node/issues/21078,5,4,0,5.013262348215922,1.9849418206707734,7.742470910335387
305,`vm.Script`'s `importModuleDynamically` should get a reference to the `context` used to run it,https://github.com/nodejs/node/issues/35714,4,2,6,17.37405908310417,3.9452429842573578,7.722621492128679
34,[async_hooks] - A possible bug or requirement of clarity?  Perhaps another hook needed?,https://github.com/nodejs/node/issues/22052,5,2,1,7.450255209721839,1.9000684462696784,7.700034223134839
838,Detecting client request aborts in nodejs >= 15.50 is broken,https://github.com/nodejs/node/issues/46666,5,5,13,35.97362934775655,1.5852156057494866,7.542607802874743
230,./deps/v8/third_party/zlib instead of the copy in ./deps/zlib ?,https://github.com/nodejs/node/issues/33848,4,3,1,6.269957162006729,3.509924709103354,7.504962354551677
390,investigate flaky test-fs-utimes in CI on Pi2,https://github.com/nodejs/node/issues/37692,4,4,0,4.174777422578695,3.4962354551676933,7.498117727583846
658,startup snapshot integration in packaging solutions,https://github.com/nodejs/node/issues/42566,5,3,12,33.23952144707632,1.4948665297741273,7.497433264887063
248,dns.resolveSoa returns EBADRESP if hostname has a CNAME record,https://github.com/nodejs/node/issues/34612,4,3,1,6.254370534870837,3.482546201232033,7.4912731006160165
635,distutils package deprecation warning in configure.py,https://github.com/nodejs/node/issues/42186,5,3,2,9.442299266413203,1.4428473648186173,7.471423682409308
801,resetAndDestroy can not be called on tlssocket?,https://github.com/nodejs/node/issues/49484,5,4,3,11.75641868007424,1.4072553045859,7.45362765229295
871,flaky parallel/test-net-write-fully-async-buffer,https://github.com/nodejs/node/issues/47428,5,3,0,4.677039280403971,1.3579739904175223,7.428986995208761
220,doc: <integer> is misleading,https://github.com/nodejs/node/issues/33585,5,2,1,6.895109815376691,1.1991786447638604,7.34958932238193
984,"misleading error: Cannot find package '.../package.json', when package.json exists",https://github.com/nodejs/node/issues/49674,5,4,4,13.50885584066405,1.002053388090349,7.251026694045175
1023,NodeWorker.sendMessageToWorker fails with multi-byte code points in JSON,https://github.com/nodejs/node/issues/50516,5,3,0,4.499234792973427,0.9938398357289527,7.246919917864476
98,"inspector.open(0, undefined, /* wait */true) won't allow communicating inspector.url()",https://github.com/nodejs/node/issues/28663,5,4,0,4.482135043472816,0.9555099247091033,7.227754962354552
205,flaky test-dgram-multicast-ssmv6-multi-process on linux,https://github.com/nodejs/node/issues/32946,4,3,0,3.9656988000866016,2.951403148528405,7.225701574264202
1100,Use system certificate store when running under Windows,https://github.com/nodejs/node/issues/51537,5,5,99,225.56574094789622,0.919917864476386,7.209958932238193
1065,require() no longer follows symlinks after calling statSync() on a FIFO or socket file,https://github.com/nodejs/node/issues/51142,5,5,0,4.46430165723298,0.9144421629021219,7.207221081451061
1133,consider allowing libnode.h (libnode.a/ libnode.lib) and libnode.wasm for nodejs,https://github.com/nodejs/node/issues/51790,5,5,2,8.83514858402588,0.7994524298425736,7.149726214921287
139,child_process: ERR_INVALID_ARG_TYPE on .kill(),https://github.com/nodejs/node/issues/30702,3,2,0,3.0228936600328775,4.7967145790554415,7.148357289527721
1136,Buffer.utf8Write() fails to write when buffer length exceeds 2 GB,https://github.com/nodejs/node/issues/51817,5,4,0,4.405256320026903,0.7665982203969883,7.133299110198494
143,Investigate flaky test parallel/test-module-loading-globalpaths,https://github.com/nodejs/node/issues/30844,3,3,0,3.0133499365381713,4.75564681724846,7.12782340862423
793,Partially consuming fs.ReadStream closes file handle despite `autoClose: false`,https://github.com/nodejs/node/issues/45721,5,2,0,4.390629220929206,0.7255304585900069,7.112765229295004
1244,HTTP2 server memory explodes and terminated,https://github.com/nodejs/node/issues/52952,5,4,0,4.361227808142332,0.6324435318275154,7.066221765913758
1218,Tracking issue: compile cache,https://github.com/nodejs/node/issues/52696,5,3,3,10.901134311856216,0.6297056810403833,7.064852840520191
619,Intermittent faiures in parallel/test-vm-timeout-escape-promise-module,https://github.com/nodejs/node/issues/41839,4,4,1,5.745279745859791,2.6036960985626285,7.051848049281315
216,errorMonitor be emitted consistently,https://github.com/nodejs/node/issues/33505,5,4,0,4.352328995204266,0.5995893223819302,7.049794661190965
1115,Allow inspector flags with SEA binaries via configuration,https://github.com/nodejs/node/issues/51688,5,4,0,4.3509319276882765,0.5941136208076659,7.047056810403833
1132,Support remote sourceMap,https://github.com/nodejs/node/issues/51781,5,3,2,8.700486080960586,0.5913757700205339,7.045687885010267
1295,Node SEA ESM support,https://github.com/nodejs/node/issues/53565,5,2,6,17.324522348648102,0.49828884325804246,6.999144421629021
1075,Migration of the GitHub bot from our infra to GitHub actions,https://github.com/nodejs/node/issues/51236,5,4,0,4.330710796440892,0.49555099247091033,6.997775496235455
472,Mac M1 (ARM) Elasticsearch access via TLS connection is broken,https://github.com/nodejs/node/issues/39216,5,3,0,4.330710796440892,0.49555099247091033,6.997775496235455
99,Memory leak with debugger running.,https://github.com/nodejs/node/issues/28787,4,4,1,5.663163250594116,2.4640657084188913,6.982032854209446
176,console.group() emits duplicate CDP messages,https://github.com/nodejs/node/issues/31973,5,3,1,6.489620501560874,0.46269678302532513,6.981348391512663
10,Support changing the active stack frame in CLI debugger (`node inspect`),https://github.com/nodejs/node/issues/40910,3,2,1,4.3889562420537445,4.383299110198494,6.9416495550992465
112,Different behavior of async_hooks between Node 10 and 12 version,https://github.com/nodejs/node/issues/29323,5,3,5,15.133689632893255,0.35592060232717315,6.927960301163586
1308,Promise rejection in timeout (versus module-level) treated as unhandled by debugger,https://github.com/nodejs/node/issues/53732,5,2,0,4.3241274581006355,0.3531827515400411,6.926591375770021
734,assert.deepStrictEqual() and the `vm` module are incompatible,https://github.com/nodejs/node/issues/44462,5,4,3,10.81090003163334,0.35044490075290896,6.925222450376454
1214,Error with child_process spawn after updating to node 20.11.0,https://github.com/nodejs/node/issues/52667,5,5,1,6.5065558530747465,0.27652292950034224,6.888261464750171
117,Node Debugger Caught in Loop When Debugging Async Functions,https://github.com/nodejs/node/issues/29556,5,2,2,8.712014188761762,0.2272416153319644,6.863620807665982
1317,Support for running bin scripts using `node --run`,https://github.com/nodejs/node/issues/53845,5,4,0,4.359980298466371,0.2190280629705681,6.8595140314852845
1290,Option to have a shared V8 library?,https://github.com/nodejs/node/issues/53509,5,4,0,4.368839730022266,0.2026009582477755,6.851300479123887
1396,Add a new env var `UV_LOOP_ENABLE_IO_URING_SQPOLL`,https://github.com/nodejs/node/issues/54858,5,3,0,4.377230192806059,0.188911704312115,6.844455852156058
1130,"readdirSync cannot read files properly when using { recursive: true, withFileTypes: true }",https://github.com/nodejs/node/issues/51773,5,3,0,4.386627607920165,0.17522245037645448,6.837611225188227
134,child_process normalization logic can be bypassed,https://github.com/nodejs/node/issues/30640,4,3,0,3.6538429569698714,2.1546885694729636,6.827344284736482
1423,"""Fatal error in , line 0 unreachable code"" in v20.17.0",https://github.com/nodejs/node/issues/55289,5,5,0,4.411349747578879,0.14510609171800137,6.822553045859001
383,setcap on Node.js prevents processing of NODE_OPTIONS,https://github.com/nodejs/node/issues/37588,4,4,3,9.102326289311495,2.1218343600273784,6.810917180013689
578,"writable.end(cb), the cb is never called",https://github.com/nodejs/node/issues/40851,5,4,0,4.439584206577208,0.11772758384668036,6.80886379192334
1061,HTTP/2 null pointer exceptions in insecure server.,https://github.com/nodejs/node/issues/51094,5,3,1,6.6842691410020025,0.10403832991101986,6.80201916495551
302,Some statements have already been executed when debugger stops at line breakpoint,https://github.com/nodejs/node/issues/35660,4,4,10,21.7939490200073,2.099931553730322,6.799965776865161
366,console-display:  Symbol.toStringTag NOT work when extends EventTarget,https://github.com/nodejs/node/issues/37329,5,4,0,4.467047249604234,0.09582477754962354,6.797912388774812
104,Expose the default module resolver in a package,https://github.com/nodejs/node/issues/49454,3,3,1,4.2851949953784825,4.093086926762491,6.796543463381246
1461,napi_threadsafe_function is very hard to use safely,https://github.com/nodejs/node/issues/55706,5,3,0,4.47470430299082,0.09034907597535935,6.79517453798768
221,Use stream._construct,https://github.com/nodejs/node/issues/33586,5,3,3,11.206777710631767,0.08487337440109514,6.7924366872005475
289,doc: Options passed needlessly to https request object and agent prop,https://github.com/nodejs/node/issues/35360,5,3,0,4.486851480538815,0.08213552361396304,6.791067761806982
736,"bug: segmentation fault in REPL when trying to use AbortController with node-fetch package, dynamic import and timeouts",https://github.com/nodejs/node/issues/44464,5,3,1,6.7302772208082215,0.08213552361396304,6.791067761806982
508,Core should bundle a code formatter for contributors.,https://github.com/nodejs/node/issues/39794,5,4,0,4.49985113622654,0.07392197125256673,6.786960985626283
1462,Port/Duplicate async_hooks tests to use AsyncLocalStore,https://github.com/nodejs/node/issues/55712,5,2,0,4.509027162397695,0.06844626967830253,6.784223134839151
980,Tracking issue for Fastify regressions,https://github.com/nodejs/node/issues/49600,5,2,0,4.523616164844858,0.06023271731690623,6.780116358658453
1282,Clear kResourceStore in timers and intervals,https://github.com/nodejs/node/issues/53408,5,3,8,22.75182187402344,0.04654346338124572,6.773271731690623
1502,The `http.Server` adds a `Transfer-Encoding: chunked` header when the response has no body,https://github.com/nodejs/node/issues/55965,5,4,0,4.580606985443413,0.03285420944558522,6.766427104722792
365,big-string will cause heap out of memory,https://github.com/nodejs/node/issues/37316,5,4,0,4.587129441357114,0.030116358658453114,6.765058179329227
644,[Bug] npm/npx/corepack scripts use global shebang which is wrong,https://github.com/nodejs/node/issues/42367,5,4,1,6.901042859320529,0.024640657084188913,6.762320328542095
413,fs: add support for async iterators to `fs.writeFile`,https://github.com/nodejs/node/issues/38075,5,3,1,6.901042859320529,0.024640657084188913,6.762320328542095
1276,Migrating from object.ref()/object.unref() to process.ref()/process.unref(),https://github.com/nodejs/node/issues/53266,5,4,9,25.303823817508604,0.024640657084188913,6.762320328542095
295,CI setup for nodejs.org release notes,https://github.com/nodejs/node/issues/35530,5,4,0,4.6006952395470195,0.024640657084188913,6.762320328542095
803,test-fs-utimes-y2K38 fails on 32-bit platforms with 64-bit time_t,https://github.com/nodejs/node/issues/45906,5,4,0,4.607751848260225,0.02190280629705681,6.760951403148528
1346,Buffer.from offsets,https://github.com/nodejs/node/issues/54162,5,4,0,4.62244865894227,0.01642710472279261,6.758213552361396
1544,Node 22 doesn't honor the --watch-preserve-output command-line parameter,https://github.com/nodejs/node/issues/56330,5,2,0,4.646075312281114,0.008213552361396304,6.7541067761806985
992,fs: utf8 fast paths don't accept all valid utf8 values,https://github.com/nodejs/node/issues/49888,5,2,1,6.96911296842167,0.008213552361396304,6.7541067761806985
542,Assertion `(write_req_.result) >= (0)' failed,https://github.com/nodejs/node/issues/40345,5,2,0,4.646075312281114,0.008213552361396304,6.7541067761806985
1448,structuredClone() uses wrong context in vm.runInContext(),https://github.com/nodejs/node/issues/55554,5,4,0,4.654409013691686,0.0054757015742642025,6.752737850787132
874,parseArgs Type Definition,https://github.com/nodejs/node/issues/47487,5,2,0,4.654409013691686,0.0054757015742642025,6.752737850787132
902,Race conditions between setTimeout() & setImmediate(),https://github.com/nodejs/node/issues/48163,5,3,1,6.98161352053753,0.0054757015742642025,6.752737850787132
229,node localhost resolves to 127.0.0.1 instead of ::1 on IPv6-only network,https://github.com/nodejs/node/issues/33816,5,3,1,6.98161352053753,0.0054757015742642025,6.752737850787132
1486,test_runner: `t.after` should respect `the first-in-last-out` principle like Golang's defer,https://github.com/nodejs/node/issues/55853,5,3,0,4.654409013691686,0.0054757015742642025,6.752737850787132
1534,HTTP/1.0 responses missing Content-Length,https://github.com/nodejs/node/issues/56277,5,2,0,4.654409013691686,0.0054757015742642025,6.752737850787132
1345,"`node --v8-options`  says that you can use a space between the flag name and value, but it's not true",https://github.com/nodejs/node/issues/54145,5,3,0,4.654409013691686,0.0054757015742642025,6.752737850787132
405,"""Maximum call stack size exceeded"" causes a crash in ""async_hooks"" module",https://github.com/nodejs/node/issues/37989,5,3,0,4.662988779924873,0.0027378507871321013,6.7513689253935665
349,Attaching a `request` handler turns off the CONNECT protocol in HTTP2,https://github.com/nodejs/node/issues/36977,5,1,0,4.671825877623796,0.0,6.75
1438,"Top-level await + dynamic import + cyclic import causes ""unsettled TLA"" error",https://github.com/nodejs/node/issues/55468,5,3,1,7.007738816435694,0.0,6.75
1205,unhandledRejection Error [ERR_INTERNAL_ASSERTION],https://github.com/nodejs/node/issues/52574,5,3,0,4.671825877623796,0.0,6.75
1270,The registration order of http server listen depends on the Node.js version,https://github.com/nodejs/node/issues/53204,5,3,0,4.671825877623796,0.0,6.75
125,fs.chmod behaviour should change to be more expected across platforms,https://github.com/nodejs/node/issues/30019,5,3,0,4.671825877623796,0.0,6.75
991,Breaking ABI on an existing release line by bumping NODE_MODULE_VERSION,https://github.com/nodejs/node/issues/49875,5,3,0,4.671825877623796,0.0,6.75
491,"v16.6.0 regression — unexpected error thrown in REPL when calling require() on ES modules in a ""type"": ""module"" project",https://github.com/nodejs/node/issues/39618,5,4,1,7.007738816435694,0.0,6.75
1497,Support `concurrency` when `--experimental-test-isolation` is set to `'none'`,https://github.com/nodejs/node/issues/55939,5,2,0,4.671825877623796,0.0,6.75
1367,node:events once isn't working as expected in node-redis tests,https://github.com/nodejs/node/issues/54497,5,3,0,4.671825877623796,0.0,6.75
632,Enable CFG in node.exe,https://github.com/nodejs/node/issues/42100,5,4,1,7.007738816435694,0.0,6.75
1429,[rfc] V8 debug build CI?,https://github.com/nodejs/node/issues/55326,5,3,0,4.671825877623796,0.0,6.75
605,Inconsistent coverage information when loaders used,https://github.com/nodejs/node/issues/41387,4,3,3,8.943861666916835,1.9603011635865846,6.730150581793293
784,Build failure for armv7 architecture,https://github.com/nodejs/node/issues/45431,4,4,0,3.5336723312559437,1.8480492813141685,6.674024640657084
329,"docs improvement - ""advanced section""",https://github.com/nodejs/node/issues/36578,4,4,0,3.519807318526602,1.8124572210814511,6.656228610540726
653,node server crash & reco'd open bug fix,https://github.com/nodejs/node/issues/42505,4,3,0,3.4488613037328673,1.6290212183436004,6.5645106091718
334,"""breakpoints"" command not listing breakpoints: ""No breakpoints yet""",https://github.com/nodejs/node/issues/41790,3,3,1,4.079536224335162,3.5290896646132786,6.5145448323066395
164,doc: Improve docs search engine indexing,https://github.com/nodejs/node/issues/31598,4,4,0,3.407075857695266,1.5195071868583163,6.509753593429158
371,Duplicate v8 target errors when cross-compiling,https://github.com/nodejs/node/issues/37441,4,3,1,5.070348637914924,1.4483230663928817,6.47416153319644
97,fs.access throws permission error while checking W_OK on writable dir,https://github.com/nodejs/node/issues/28656,3,3,0,2.6899597163254043,3.4086242299794662,6.454312114989733
698,`Writer` cannot cope with `ArrayBuffer`,https://github.com/nodejs/node/issues/43433,4,4,0,3.3628452291818887,1.4017796030116358,6.450889801505818
62,http socket might get reset instead of normal close while handling timeout,https://github.com/nodejs/node/issues/26166,4,2,5,11.70609437878733,1.352498288843258,6.426249144421629
95,[C++ Lint Rule] #define indentation is Inconsistent,https://github.com/nodejs/node/issues/28605,3,3,1,4.009499708270204,3.3401779603011637,6.420088980150582
758,`child_process.spawn` with inherited stdout breaks logging colors on Windows even after childprocess exits,https://github.com/nodejs/node/issues/45009,4,4,0,3.301823581610767,1.2347707049965777,6.367385352498289
959,Crash during ThreadSafeFunction finalization,https://github.com/nodejs/node/issues/49171,4,4,0,3.280475920460199,1.1745379876796715,6.337268993839836
888,console.timeStamp(...) and performance.mark/measure are missing from the --inspect Performance Timings timeline,https://github.com/nodejs/node/issues/47813,4,3,7,14.706292396840603,1.1389459274469542,6.319472963723477
532,CTRL-C does not quit readline when in infinte loop,https://github.com/nodejs/node/issues/40140,3,2,0,2.6190981033372647,3.1238877481177276,6.311943874058864
50,Does `autoDestroy` make sense for http2 streams?,https://github.com/nodejs/node/issues/24576,4,4,2,6.51726420780145,1.111567419575633,6.305783709787817
1031,"test runner (--test, node:test)  subtest test context lack `.skip`, `.only` and `.todo` functions",https://github.com/nodejs/node/issues/50665,4,3,2,6.491214921396081,1.0732375085557837,6.2866187542778915
128,suggested updates to the onboarding doc,https://github.com/nodejs/node/issues/30116,2,2,0,1.6719646327040685,5.007529089664613,6.253764544832307
908,Support GMAC and multiple AAD chunks for AEAD,https://github.com/nodejs/node/issues/48314,4,3,0,3.2106200119493633,0.9664613278576317,6.233230663928816
123,Http2Stream emit connection related 'error' after receiving all data of stream.,https://github.com/nodejs/node/issues/29929,4,3,0,3.2088842362210603,0.9609856262833676,6.230492813141684
146,Debugger isn't stopped at the `debugger;` statement when debugging using `--inspect`,https://github.com/nodejs/node/issues/30911,3,3,0,2.5751074938230554,2.948665297741273,6.224332648870637
974,ERR_UNHANDLED_REJECTION wrongly reported in node 18 when running junit test.,https://github.com/nodejs/node/issues/49507,4,4,0,3.1986052535235063,0.9281314168377823,6.214065708418891
377,Error when restarting a `node inspect` run after setting break point twice,https://github.com/nodejs/node/issues/41789,4,1,0,3.1977595585614473,0.9253935660506503,6.212696783025325
958,`require.cache` is `undefined` in SEA,https://github.com/nodejs/node/issues/49163,4,3,0,3.1861077094512176,0.8870636550308009,6.1935318275154
195,Describe alternatives to require.extensions,https://github.com/nodejs/node/issues/32483,3,3,16,23.00200189684629,2.8720054757015743,6.186002737850787
91,http server respond with inappropriate default headers for `HEAD` method,https://github.com/nodejs/node/issues/28438,3,3,0,2.552321268998192,2.858316221765914,6.179158110882957
481,execFileSync() causes different behaviour for some software,https://github.com/nodejs/node/issues/39354,4,3,0,3.166265741789947,0.8186173853524983,6.159308692676249
144,move things away from process.binding('util'),https://github.com/nodejs/node/issues/30884,3,3,2,5.083884644903031,2.817248459958932,6.158624229979466
187,RFC: update Pull Requests with summary of CI failures,https://github.com/nodejs/node/issues/32306,4,2,3,7.889430512463726,0.7802874743326489,6.1401437371663246
189,benchmark: http simple connect timeout on macOS,https://github.com/nodejs/node/issues/32337,4,4,2,6.308626665262887,0.7748117727583846,6.1374058863791925
1179,Please add latest brotli 1.1.0 bindings with compression dictionary support,https://github.com/nodejs/node/issues/52250,4,4,3,7.862737900531832,0.7392197125256673,6.119609856262834
199,Exception while running 'es' benchmarks,https://github.com/nodejs/node/issues/32653,4,2,0,3.1423558626256125,0.7282683093771389,6.1141341546885695
1155,"Module resolution failure when using ""#/"" in `imports`",https://github.com/nodejs/node/issues/51949,4,4,0,3.140333022517453,0.7200547570157426,6.110027378507871
201,Optional Memory benchmark flag in benchmarking scripts,https://github.com/nodejs/node/issues/32713,4,2,0,3.1396649009333215,0.7173169062286106,6.108658453114305
462,investigate flaky wpt/test-timers on Raspberry Pi,https://github.com/nodejs/node/issues/39018,4,4,0,3.1383380490487194,0.7118412046543463,6.105920602327173
1183,Support loading dynamic addon modules (`.node` files) when embedding the Node.js shared library without needing to link with `node.def`,https://github.com/nodejs/node/issues/52282,4,3,0,3.1318985540627957,0.6844626967830253,6.092231348391513
915,V8 Inspector is not available in --require in `node --test`,https://github.com/nodejs/node/issues/48467,4,4,8,15.653255811540655,0.6789869952087612,6.089493497604381
892," [ERR_INVALID_ARG_TYPE]: The ""path"" argument must be of type string. Received an instance of Buffer",https://github.com/nodejs/node/issues/47879,4,3,0,3.126397476915555,0.6598220396988365,6.079911019849418
675,NodeJS Crashed,https://github.com/nodejs/node/issues/43057,4,4,0,3.1223265263407707,0.6406570841889117,6.0703285420944555
