,Title,URL,Comment Count,Unique Commenters,Upvotes,Engagement Score,Years Opened,Frustration Score
73,Invalidate cache when using import,https://github.com/nodejs/node/issues/49442,100,30,69,86983.9318638788,5.49760438056126,104.49880219028063
161,Support for Import Maps,https://github.com/nodejs/node/issues/49443,100,16,65,77988.10445466892,4.802190280629706,104.15109514031485
63,import.meta.main,https://github.com/nodejs/node/issues/49440,99,30,88,107495.29705234927,5.352498288843258,103.42624914442163
1052,enable corepack by default,https://github.com/nodejs/node/issues/50963,100,23,211,171526.88219849768,0.999315537303217,102.2496577686516
972,Discussion: New “ESM by default” mode,https://github.com/nodejs/node/issues/49432,98,14,22,18705.820687030176,0.07939767282683094,99.78969883641342
708,How could we support typescript without vendoring it?,https://github.com/nodejs/node/issues/43818,95,29,140,110976.94565979125,1.4373716632443532,97.46868583162218
2,zlib deflate results in a memory leak,https://github.com/nodejs/node/issues/8871,73,22,16,15319.10415586541,7.170431211498974,78.33521560574948
77,Discussion: private fields and util.inspect,https://github.com/nodejs/node/issues/27404,74,13,4,4227.736478877129,4.172484599589322,77.83624229979466
215,"add API for ""package dir""",https://github.com/nodejs/node/issues/49445,72,12,9,7640.387129016448,4.501026694045175,76.00051334702259
565,Thrown AbortErrors are not DOMExceptions,https://github.com/nodejs/node/issues/40692,65,9,4,3123.989604456693,2.973305954825462,68.23665297741273
177,Performance of for await of (async iteration),https://github.com/nodejs/node/issues/31979,64,10,7,5015.454681582634,3.972621492128679,67.73631074606433
138,Migration of core modules to primordials,https://github.com/nodejs/node/issues/30697,64,16,4,2774.762686131636,2.0506502395619437,66.77532511978097
40,N-API: An api for embedding Node in applications,https://github.com/nodejs/node/issues/23265,56,17,1,1586.5014581848855,5.927446954141,60.7137234770705
429,HTTP/3 support,https://github.com/nodejs/node/issues/38478,57,30,261,109677.10923802052,2.7214236824093088,60.110711841204655
6,Node.js' internal scripts should be hidden in the inspector.,https://github.com/nodejs/node/issues/11893,54,20,3,2736.4346297963884,7.353867214236824,59.426933607118414
884,`message` tests can be migrated from python to JS,https://github.com/nodejs/node/issues/47707,57,9,0,667.6350816996128,0.5284052019164955,59.01420260095825
70,Proposal for single-mode packages with optional fallbacks for older versions of node,https://github.com/nodejs/node/issues/49450,55,10,7,4151.704668178225,4.435318275154004,58.967659137577
1312,Support .noderc or similar file-based initialization configurations?,https://github.com/nodejs/node/issues/53787,57,15,6,2705.313833708204,0.16700889801505817,58.83350444900753
696,Entrypoint Hooks (carry over discussion from Austin Collab Summit),https://github.com/nodejs/node/issues/43408,57,13,2,1360.7853008165894,0.13689253935660506,58.818446269678304
957,`.env` file support issue tracker,https://github.com/nodejs/node/issues/49148,56,25,0,672.5482297668493,0.9637234770704997,58.23186173853525
261,Tracking Issue: commit queue issues and feedback,https://github.com/nodejs/node/issues/34770,53,12,0,678.6404092960572,1.8069815195071868,55.653490759753595
703,Support Web Workers,https://github.com/nodejs/node/issues/43583,49,21,327,106542.14977617562,2.4668035592060233,51.983401779603014
818,AsyncLocalStorage and deferred promises,https://github.com/nodejs/node/issues/46262,48,11,0,548.221322396722,0.02190280629705681,49.76095140314853
500,build: provide pre-built nodejs/node images or cache ,https://github.com/nodejs/node/issues/39672,45,8,9,2638.196835873856,0.8596851471594799,47.17984257357974
802,Expose a faster way to create objects with properties for Node-API,https://github.com/nodejs/node/issues/45905,44,8,5,1701.10543163113,1.3141683778234086,46.4070841889117
977,Discussion: Name of the flag for the “ESM by default” mode,https://github.com/nodejs/node/issues/49541,42,9,1,659.3412892530147,0.06570841889117043,43.78285420944559
433,Future of the Node HTTP Client ,https://github.com/nodejs/node/issues/38533,41,13,1,610.1891370613632,0.30390143737166325,42.90195071868583
637,Async hooks cause programs with frozen promises to crash,https://github.com/nodejs/node/issues/42229,41,10,1,649.1739900389285,0.02190280629705681,42.76095140314853
747,Requiring a dynamically added dependency fails when the package has no `index.js` file,https://github.com/nodejs/node/issues/44663,39,12,6,1538.644041066282,0.7912388774811773,41.14561943874059
685,Expose Undici's ProxyAgent and setGlobalDispatcher within Node,https://github.com/nodejs/node/issues/43187,38,20,49,11182.822056857216,2.3846680355920604,40.94233401779603
457,"Core dump with ""double free detected in tcache 2"" or assertion failure when using http2 client via @grpc/grpc-js",https://github.com/nodejs/node/issues/38964,38,11,3,1012.9411159650351,1.6563997262149213,40.57819986310746
11,domain migration to async_hooks,https://github.com/nodejs/node/issues/17143,37,10,0,422.91904994179225,2.4202600958247777,39.960130047912386
183,buffer: ~2x slowdown in master compared to v12.x,https://github.com/nodejs/node/issues/32226,37,11,8,2100.0685123696203,2.3545516769336072,39.927275838466805
624,The ESM resolver does not respect package `main`s for packages imported via relative imports,https://github.com/nodejs/node/issues/41940,38,9,0,362.53042187540467,0.33675564681724846,39.918377823408626
39,"Almost guaranteed ECONNRESET on piped sockets if connecting to Node's HTTPS server which answers with ""connection: 'close'"" after setImmediate or setTimeout, on OSX",https://github.com/nodejs/node/issues/23169,35,25,20,5719.993886592161,5.853524982888432,39.676762491444215
608,Add a utility to convert file URL or path to one of them?,https://github.com/nodejs/node/issues/41521,36,11,3,1069.3054492885033,2.937713894592745,39.21885694729637
4,What will Domain be replaced with?,https://github.com/nodejs/node/issues/10843,34,15,30,8459.601655075798,6.787132101300479,39.143566050650236
595,stack size exceeded on M1/arm64 but not on x86,https://github.com/nodejs/node/issues/41163,36,8,0,363.73799453885397,1.4154688569472964,38.45773442847365
158,Dynamic import does not show location of SyntaxError,https://github.com/nodejs/node/issues/49441,34,14,13,3400.059666384163,4.572210814510609,38.036105407255306
18,child_process stdout being truncated,https://github.com/nodejs/node/issues/19218,32,13,18,4601.397783023419,6.034223134839151,36.767111567419576
72,Documented way to add certificates to existing SecureContext,https://github.com/nodejs/node/issues/27079,32,7,7,1968.431800829551,5.30321697467488,36.40160848733744
65,setTimeout Calling Callback Too Early,https://github.com/nodejs/node/issues/26578,32,10,5,1453.4667023857244,4.61327857631759,36.05663928815879
785,Native zip support,https://github.com/nodejs/node/issues/45434,33,12,41,7421.985081719125,2.1245722108145104,35.81228610540725
967,URL does not match the web; does not allow changing protocol from `about:`,https://github.com/nodejs/node/issues/49319,34,10,0,328.40833420757383,0.013689253935660506,35.75684462696783
387,Roadmap for stabilization of vm modules,https://github.com/nodejs/node/issues/37648,32,16,102,19770.685518501403,3.564681724845996,35.532340862423
140,addons/openssl-binding/test very flaky on ARM,https://github.com/nodejs/node/issues/30786,33,7,0,312.96428480426374,1.2347707049965777,35.36738535249829
610,Start moving to Uint8Array in new APIs?,https://github.com/nodejs/node/issues/41588,32,15,65,10614.245698732937,1.7631759069130732,34.63158795345654
74,readable.push always returning false after reaching highWaterMark for the first time,https://github.com/nodejs/node/issues/27106,32,8,0,311.3002971268039,1.6043805612594113,34.5521902806297
1252,AsyncLocalStorage loses the store if used together with createHook if there is a async function in between,https://github.com/nodejs/node/issues/53037,32,6,0,295.0696934762747,0.04380561259411362,33.77190280629706
15,listening to sigint don't exit nicely,https://github.com/nodejs/node/issues/18600,30,8,0,323.98238200076736,2.8939082819986313,33.19695414099932
1154,Proposal: Alternative to enabling Corepack by default,https://github.com/nodejs/node/issues/51931,31,13,1,403.82568055800266,0.6269678302532512,33.063483915126625
1,"Lexical variable declarations (`let`, `const`) unusable in repl if error thrown during declaration/first assignment",https://github.com/nodejs/node/issues/8309,27,17,12,2773.5537792641226,7.770020533880904,32.635010266940455
131,console.log failure while working with worker threads.,https://github.com/nodejs/node/issues/30491,29,9,2,655.5395474697941,3.5564681724845997,32.5282340862423
1015,Proposal: Have the ESM loader handle all entry points,https://github.com/nodejs/node/issues/50356,30,9,4,797.4789327547802,1.0431211498973305,32.271560574948666
96,There appears to be a bug with the http2 header decoding,https://github.com/nodejs/node/issues/28632,29,6,0,250.7009095127564,0.9664613278576317,31.233230663928815
571,Usage of Oilpan / V8 C++ Garbage Collector,https://github.com/nodejs/node/issues/40786,28,7,3,722.039032844067,2.7789185489390826,31.13945927446954
148,Secure memory: Yay or nay,https://github.com/nodejs/node/issues/30956,28,11,2,545.6670844899052,2.2286105407255303,30.864305270362767
86,No content length on DELETE and OPTIONS,https://github.com/nodejs/node/issues/27880,26,8,0,299.8018740613034,4.432580424366872,29.966290212183438
17,Merge streams handling code for http2 streams & net.Socket,https://github.com/nodejs/node/issues/19060,26,12,0,260.2677130707278,2.8501026694045173,29.17505133470226
64,buffer.indexOf is incorrect in utf16le encoding for odd byteOffset,https://github.com/nodejs/node/issues/26448,27,7,0,232.01856010517753,0.01642710472279261,28.758213552361397
720,'use strict' is ignored on mips64el/riscv64 when compiled with gcc 12,https://github.com/nodejs/node/issues/44126,26,8,0,237.7144132228061,1.9822039698836413,28.74110198494182
332,WebAssembly compiled module cache,https://github.com/nodejs/node/issues/36671,25,10,9,1473.055712252412,3.789185489390828,28.644592744695416
1231,remove the warning about performance hit in --experimental-detect-module,https://github.com/nodejs/node/issues/52803,26,6,0,206.11775741603427,0.5722108145106092,28.036105407255306
691,Node incorrectly throws `ERR_UNHANDLED_REJECTION` on error caught in `Promise.catch`,https://github.com/nodejs/node/issues/43326,25,10,0,235.56206554175898,2.4476386036960984,27.97381930184805
987,"`Promise.resolve('import(""node:fs"")').then(eval)` throws `TypeError: Invalid host defined options`",https://github.com/nodejs/node/issues/49726,26,7,0,214.32490285641313,0.06297056810403832,27.781485284052017
1005,createWriteStream has problems in a CIFS mount path with node 20.x.x and node 18.18.0,https://github.com/nodejs/node/issues/50061,26,5,0,217.57350204861933,0.030116358658453114,27.765058179329227
764,feat: Implement a way to expose static files from a directory (similar to Python SimpleHttpServer),https://github.com/nodejs/node/issues/45079,25,13,0,223.39551950360922,1.9520876112251881,27.726043805612594
240,Undeprecate _stream_wrap,https://github.com/nodejs/node/issues/34296,25,7,0,211.13623023596315,1.4428473648186173,27.47142368240931
655,[http.IncomingMessage] `req.toWeb()`,https://github.com/nodejs/node/issues/42529,24,10,32,3869.5849324080214,2.7104722792607805,27.10523613963039
1054,Improve DX of importing ESM-compiled-to-CJS from native ESM,https://github.com/nodejs/node/issues/50981,25,12,0,195.3998423072222,0.6598220396988365,27.07991101984942
1187,Redesign of the Node.js API Docs,https://github.com/nodejs/node/issues/52343,25,10,19,2048.655353313709,0.6379192334017796,27.06895961670089
290,`vm.compileFunction(source)` is much slower than `new vm.Script(source)`,https://github.com/nodejs/node/issues/35375,22,9,19,2374.534641384362,4.05201916495551,25.776009582477755
1250,Bare specifiers definition.,https://github.com/nodejs/node/issues/53022,24,3,0,196.1490539641609,0.0027378507871321013,25.751368925393567
356,Userland transferable/cloneable objects,https://github.com/nodejs/node/issues/37080,22,9,7,992.7864829126921,3.7645448323066395,25.63227241615332
250,Remove restriction on '/' prefixes,https://github.com/nodejs/node/issues/49449,22,3,0,207.0130677902503,3.0718685831622174,25.285934291581107
477,doc: mark String decoder as legacy,https://github.com/nodejs/node/issues/39301,22,6,3,515.3496905310697,3.028062970568104,25.26403148528405
1014,npm spining in recvfrom() when run on s390x via qemu,https://github.com/nodejs/node/issues/50339,23,6,0,174.25097777748385,0.7939767282683093,25.146988364134156
0,vm: references to context inside objects are not === the original context,https://github.com/nodejs/node/issues/855,21,10,0,223.70357869911015,4.783025325119781,25.14151266255989
501,IBM i test failures (`read ECONNRESET`),https://github.com/nodejs/node/issues/39683,23,7,0,174.0070439838757,0.7775496235455168,25.13877481177276
1081,node:test APIs returning Promises clashes with no-floating-promises lint rule,https://github.com/nodejs/node/issues/51292,23,10,13,1286.0117320633074,0.5694729637234771,25.03473648186174
1035,Corrupted file read/write,https://github.com/nodejs/node/issues/50717,23,5,1,260.69699834066756,0.15331964407939766,24.826659822039698
1425,Internal node assertion caused by js copy mechanism,https://github.com/nodejs/node/issues/55302,23,8,0,179.57377539833388,0.04654346338124572,24.773271731690624
988,Global setup file for native node test runner,https://github.com/nodejs/node/issues/49732,22,12,17,1608.8629357088535,1.1800136892539357,24.340006844626966
1199,HTTP 449 error sending request from node version 17 and above,https://github.com/nodejs/node/issues/52449,22,6,0,159.6029542837841,0.4216290212183436,23.960814510609172
493,ReadableStream internal state,https://github.com/nodejs/node/issues/39627,22,6,0,161.11979166615174,0.2108145106091718,23.855407255304584
1381,Expose `setMaxListeners` property on `AbortSignal`,https://github.com/nodejs/node/issues/54758,22,8,0,161.66520129237813,0.1861738535249829,23.843086926762492
665,Investigate flaky test-http-server-request-timeout-keepalive,https://github.com/nodejs/node/issues/42741,21,7,0,176.17463648993393,2.1738535249828885,23.836926762491444
1485,Expose an `id` for concurrent test runners (like `JEST_WORKER_ID`),https://github.com/nodejs/node/issues/55842,22,6,1,251.37203621412903,0.05201916495550993,23.776009582477755
311,[Proposal] Deprecate --without-intl compilation flag,https://github.com/nodejs/node/issues/35942,21,11,0,156.39164272954736,1.0869267624914443,23.293463381245722
997,sequential.test-watch-mode-inspect seems flaky,https://github.com/nodejs/node/issues/49933,21,6,0,154.2359002725387,0.9500342231348392,23.22501711156742
551,Openssl 3 with NODE_EXTRA_CA_CERTS slows down node.js v17 startup,https://github.com/nodejs/node/issues/40524,21,4,1,228.97481002981274,0.840520191649555,23.170260095824776
1101,"""Fatal error, unreachable code"" seen intermittently on v20.10.0",https://github.com/nodejs/node/issues/51555,21,9,14,1208.8283577766779,0.7200547570157426,23.110027378507873
464,Writable does not check if stream has been destroyed during _final and _write,https://github.com/nodejs/node/issues/39030,20,12,1,247.4179855276325,2.242299794661191,22.871149897330596
440,Stream finished does not always work with http incoming message,https://github.com/nodejs/node/issues/38657,21,8,0,149.76981245885239,0.24093086926762491,22.87046543463381
1010,HTTP Server close is taking up to 5 seconds in node 18,https://github.com/nodejs/node/issues/50188,21,4,3,400.6254000666732,0.0054757015742642025,22.75273785078713
1148,"`""packageManager""` field doesn’t support npm",https://github.com/nodejs/node/issues/51888,21,6,5,561.9094574533192,0.0027378507871321013,22.751368925393567
239,Graceful close for HTTP2 sessions,https://github.com/nodejs/node/issues/34265,19,8,4,534.7693769386361,3.8412046543463383,22.67060232717317
66,Debug worker_threads,https://github.com/nodejs/node/issues/26609,18,9,47,4628.592916092491,5.634496919917864,22.567248459958932
12,Debugger crashes with assertion failure while using Chrome DevTools and remote debug,https://github.com/nodejs/node/issues/17259,19,16,7,772.7039936473992,3.4223134839151266,22.461156741957563
546,16.11.1 cant build and execute on FreeBSD 13,https://github.com/nodejs/node/issues/40467,19,12,1,252.43022244922207,3.2060232717316905,22.353011635865844
577,implement URLPattern,https://github.com/nodejs/node/issues/40844,19,14,23,2081.766835699037,3.0965092402464065,22.298254620123203
921,"cluster.worker.on('message', (msg) => ...) fails to register a callback if ESM file extensions is used",https://github.com/nodejs/node/issues/48578,20,5,0,143.5056656823557,0.9609856262833676,22.230492813141684
927,Ghost-based benchmark have worse performance on node v20.3.0/v20.3.1,https://github.com/nodejs/node/issues/48654,20,4,0,142.67132561113746,0.9007529089664613,22.20037645448323
782,Proposal: Replacing ICU with ztd.text or encoding_rs,https://github.com/nodejs/node/issues/45389,20,8,3,353.9137149187736,0.8158795345653662,22.157939767282684
963,"writableStream.destroy() closes the underlying file even when stream is created with {autoClose: false, emitClose: false}",https://github.com/nodejs/node/issues/49241,20,6,0,141.2622927768852,0.7912388774811773,22.14561943874059
1177,"Node.js is showing error ""node: /lib64/libm.so.6: version `GLIBC_2.27' not found (required by node)""",https://github.com/nodejs/node/issues/52241,20,15,0,140.90415148319377,0.7611225188227242,22.130561259411362
120,The differences between http2 compatibility API and http[s],https://github.com/nodejs/node/issues/29829,18,7,19,1840.3352307879613,4.618754277891855,22.059377138945926
1045,`--conditions xxx` cannot pass into `worker_thread`,https://github.com/nodejs/node/issues/50885,20,6,1,208.04722927771152,0.5174537987679672,22.008726899383984
283,It's possible to push data to a Readable in mid-destroy state,https://github.com/nodejs/node/issues/35303,20,5,0,139.6094196914823,0.2135523613963039,21.85677618069815
398,`fs.closeSync` and `fs.close` crash node process when `fd` is a random integer,https://github.com/nodejs/node/issues/37874,20,6,0,142.16831435920392,0.11498973305954825,21.807494866529773
982,Downgrade to npm v9.6.4 or v9.6.5 to avoid potential licensing issues,https://github.com/nodejs/node/issues/49625,20,11,1,221.17208871649083,0.02190280629705681,21.76095140314853
375,What should we do with unknown import assertions?,https://github.com/nodejs/node/issues/37474,20,5,0,149.49842808396147,0.0,21.75
490,[DNS] TLSA records [HTTPS] DANE request,https://github.com/nodejs/node/issues/39569,18,9,1,236.36804758196922,3.370294318959617,21.435147159479808
60,`readable` event not emitted after `net.Socket` reconnects,https://github.com/nodejs/node/issues/25969,19,5,0,136.68645408502806,1.2320328542094456,21.36601642710472
673,AES-256-CBC-HMAC-SHA256 and similar ciphers are not recognized as authenticated ciphers,https://github.com/nodejs/node/issues/43040,19,5,0,136.64594533324419,1.2292950034223136,21.364647501711158
30,Creating a branch of the Docs using RunKit,https://github.com/nodejs/node/issues/21723,18,9,0,153.3662403529952,3.082819986310746,21.291409993155373
1219,Tracking issue: require(esm),https://github.com/nodejs/node/issues/52697,19,8,6,516.8054197742742,0.6297056810403833,21.064852840520192
294,url.pathToFileURL should not dedup '/' in path,https://github.com/nodejs/node/issues/35507,19,4,0,129.1335720555817,0.621492128678987,21.060746064339494
137,buffer: implement pooling mechanism for Buffer.allocUnsafe,https://github.com/nodejs/node/issues/30683,17,4,6,639.8728255217385,4.547570157426421,21.02378507871321
1050,ESM Hook deadlocks since 21.2.0 a3e09b3,https://github.com/nodejs/node/issues/50948,19,4,0,128.25121636249216,0.4791238877481177,20.989561943874058
650,Node 16.14.2 highWaterMark:0 doesn't handle backpressure,https://github.com/nodejs/node/issues/42457,19,6,0,128.57495377917974,0.27104722792607805,20.885523613963038
468,Future of streams,https://github.com/nodejs/node/issues/39093,19,9,6,515.3080859121546,0.2464065708418891,20.873203285420946
1191,[Bug] Re-imports in ESM are 20-25 times slower than re-requires in CommonJS,https://github.com/nodejs/node/issues/52369,19,5,0,134.66219904146863,0.049281314168377825,20.774640657084188
451,HTTP2 `res.writableFinished` without calling `.end()`,https://github.com/nodejs/node/issues/38916,18,11,0,137.83379126873444,2.0424366872005475,20.771218343600275
819,AsyncLocalStorage without Async Hooks,https://github.com/nodejs/node/issues/46265,19,9,25,1846.0391229359454,0.019164955509924708,20.75958247775496
879,Loaders that use childProcess.fork lead to endless recursion of processes,https://github.com/nodejs/node/issues/47615,19,10,5,482.68963770074987,0.0054757015742642025,20.75273785078713
147,fs async functions (both callback and promises APIs) return Errors without stack trace,https://github.com/nodejs/node/issues/30944,17,9,27,2208.808345218477,3.9534565366187544,20.726728268309376
757,Investigate flaky test-watch-mode (no. 3),https://github.com/nodejs/node/issues/44898,18,10,0,134.35881672162236,1.809719370294319,20.65485968514716
850,Missing import trace from error stack when loading a module throws an error,https://github.com/nodejs/node/issues/46992,18,8,8,664.2921487178353,1.7084188911704312,20.604209445585216
940,Conditional unhandled 'error' event when http.request with `.lookup`,https://github.com/nodejs/node/issues/48771,18,8,0,126.75389074099886,1.2840520191649556,20.392026009582477
861,Process does not exit after https request with keepAlive enabled (now default in Node 19),https://github.com/nodejs/node/issues/47228,18,8,3,308.34391880610684,1.0266940451745379,20.26334702258727
601,async_hooks: AsyncLocalStorage losing context,https://github.com/nodejs/node/issues/41285,17,10,14,1099.644120264366,2.839151266255989,20.169575633127995
102,Contexts created with vm.createContext() do not define the URL() constructor,https://github.com/nodejs/node/issues/28823,16,8,5,520.7053118075851,4.783025325119781,20.14151266255989
455,Memory allocation problem after upgrade from version 14.16.1 to 14.17.0,https://github.com/nodejs/node/issues/38957,18,8,2,237.10196454310847,0.5420944558521561,20.02104722792608
246,Improve documentation on Dual Module Packages,https://github.com/nodejs/node/issues/34515,17,5,4,397.1729262729506,2.4695414099931554,19.984770704996578
236,stream: Readable batched iteration,https://github.com/nodejs/node/issues/34207,18,6,3,295.30399946159105,0.4243668720054757,19.96218343600274
704,Code review improvements,https://github.com/nodejs/node/issues/43584,18,14,0,118.60572049280304,0.2655715263518138,19.882785763175907
41,N-API: Need SharedArrayBuffer api,https://github.com/nodejs/node/issues/23276,15,9,2,298.92917457476216,6.217659137577002,19.8588295687885
523,Package.json `exports` field: Differentiate between `./*` and `./*/`,https://github.com/nodejs/node/issues/39994,18,4,3,317.35109161770606,0.008213552361396304,19.7541067761807
1249,`import-in-the-middle` causes exception when creating `ERR_MODULE_NOT_FOUND` message,https://github.com/nodejs/node/issues/52987,18,5,5,446.7539846953894,0.0,19.75
965,Structured log package in node core,https://github.com/nodejs/node/issues/49296,17,9,5,405.97371858697267,1.2566735112936345,19.378336755646817
393,child_process 'spawn' event is emitted too soon,https://github.com/nodejs/node/issues/37782,17,5,0,115.07002463390803,1.1827515400410678,19.341375770020534
69,/etc/localtime symlink handling,https://github.com/nodejs/node/issues/26880,16,8,0,128.05531807242917,3.0444900752908968,19.272245037645447
243,addons/register-signal-handler/test and abort/test-addon-register-signal-handler failed,https://github.com/nodejs/node/issues/34410,17,3,0,109.63209780507437,0.6680355920602327,19.084017796030118
186,Piping `process.stdin` to `child.stdin` leaves behind an open handle,https://github.com/nodejs/node/issues/32291,16,8,7,554.9404254073651,2.6639288158795345,19.08196440793977
836,requestTimeout and long running uploads,https://github.com/nodejs/node/issues/46574,17,8,0,109.30940899786292,0.6242299794661191,19.06211498973306
1313,"skipFiles does not suppress ""uncaught"" exceptions in web streams",https://github.com/nodejs/node/issues/53789,17,4,0,108.47022257129561,0.3394934976043806,18.91974674880219
1330,filehandle.readableWebStream() chunks return incompatible `ArrayBuffer` instead of `Uint8Array`,https://github.com/nodejs/node/issues/54041,17,5,0,108.72125202888071,0.28473648186173856,18.892368240930868
1314,CONOUT$ no longer available for Node 22?,https://github.com/nodejs/node/issues/54161,17,6,0,110.95896101064497,0.13141683778234087,18.81570841889117
1325,DNS Lookups Failing After Updating to Latest Node 20 and 18 for IBM i,https://github.com/nodejs/node/issues/53948,17,7,0,112.41366723487138,0.08487337440109514,18.79243668720055
867,memory leak in shadow realms,https://github.com/nodejs/node/issues/47353,17,4,0,113.96951047426992,0.049281314168377825,18.774640657084188
1434,`Buffer.concat` and `Buffer.copy` silently produce invalid results when the operation involves indices equal or greater than 2^32,https://github.com/nodejs/node/issues/55422,17,5,0,116.10988005817671,0.013689253935660506,18.75684462696783
827,AsyncResource constructor arguments,https://github.com/nodejs/node/issues/46369,17,3,4,351.46838802394893,0.0,18.75
207,http: Reduce API surface,https://github.com/nodejs/node/issues/33118,16,5,4,327.6776533475469,1.5359342915811087,18.517967145790553
