,Title,URL,Comment Count,Unique Commenters,Upvotes,Engagement Score,Years Opened,Frustration Score
586,Unify node.gyp code styling,https://github.com/nodejs/node/issues/41072,1,1,0,0.4787733121549826,2.6036960985626285,4.051848049281315
1123,Expose `createErrDiff` for diffing objects,https://github.com/nodejs/node/issues/51740,2,2,2,2.200381028712375,0.5859000684462696,4.042950034223135
1071,Define certificate creation facilities,https://github.com/nodejs/node/issues/51169,2,2,1,1.6480938261731353,0.5612594113620808,4.03062970568104
1278,Customize password-based KDF in `KeyObject#export`,https://github.com/nodejs/node/issues/53359,2,2,0,1.0958074871045271,0.5010266940451745,4.000513347022587
1160,The assertion module should signals failures through messages to the test runner,https://github.com/nodejs/node/issues/52033,2,2,0,1.0956989999243543,0.49828884325804246,3.9991444216290213
561,Investigate flaky test - test-inspector-connect-main-thread,https://github.com/nodejs/node/issues/40611,1,1,0,0.47354194498338503,2.4969199178644765,3.998459958932238
1297,Warn about full access on --allow-fs-read=* and --allow-fs-write=*,https://github.com/nodejs/node/issues/53598,2,2,0,1.0955928003388036,0.49555099247091033,3.9977754962354553
1229,Programmatic SEA blob generation API,https://github.com/nodejs/node/issues/52777,2,2,0,1.0955928003388036,0.49555099247091033,3.9977754962354553
1140,AsyncLocalStorage loses its store when using WASM JSPI after first asynchronous call,https://github.com/nodejs/node/issues/51832,2,1,0,1.0953873580490907,0.49007529089664614,3.995037645448323
1049,toLocaleTimeString returns invalid time when using 24hr time format,https://github.com/nodejs/node/issues/50947,2,2,1,1.6419929142133705,0.4681724845995893,3.9840862422997945
620,Embedding: Creating Multiple Environments,https://github.com/nodejs/node/issues/41870,2,2,2,2.1888629961920762,0.459958932238193,3.9799794661190964
623,httpServer.requestTimeout aborts downloads after 100 seconds,https://github.com/nodejs/node/issues/41934,2,2,0,1.0942248797817713,0.4517453798767967,3.9758726899383983
1182,Flaky `test-worker-arraybuffer-zerofill` with V8 12.2,https://github.com/nodejs/node/issues/52274,2,2,0,1.0939878059228514,0.4407939767282683,3.970396988364134
1239,flaky: wpt/test-compression,https://github.com/nodejs/node/issues/52899,2,1,0,1.093935598948278,0.4380561259411362,3.969028062970568
244,debug code run inside vm doesn't support inline sourcemaps ,https://github.com/nodejs/node/issues/34437,2,2,0,1.093935598948278,0.4380561259411362,3.969028062970568
939,test-net-autoselectfamily.js failed,https://github.com/nodejs/node/issues/48767,2,2,0,1.0936246258238715,0.4161533196440794,3.95807665982204
1141,Attached debugger always stops on first line,https://github.com/nodejs/node/issues/51837,2,2,0,1.0938726546747461,0.35592060232717315,3.9279603011635866
1357,sqlite async API,https://github.com/nodejs/node/issues/54307,2,2,3,2.7351230094766152,0.34770704996577684,3.9238535249828885
268,"Modules doc direct execution test invalid under ""type"": ""module""",https://github.com/nodejs/node/issues/34882,2,2,0,1.0941165027434563,0.34496919917864477,3.9224845995893225
118,Impossible to catch error during tls.connect(duplex),https://github.com/nodejs/node/issues/29678,2,2,0,1.094344510328294,0.33675564681724846,3.9183778234086244
466,Running a process with DevTools debugger attached leaks memory,https://github.com/nodejs/node/issues/39063,2,2,7,4.9318614896667565,0.29842573579739906,3.8992128678986995
607,Assertion failure on HTTP/2 server,https://github.com/nodejs/node/issues/41458,2,2,0,1.0967965234044215,0.28473648186173856,3.8923682409308693
417,[Tracking Issue] Refactoring DNS,https://github.com/nodejs/node/issues/38173,1,1,4,1.3879531879222002,2.2751540041067764,3.887577002053388
19,child_process: 'close' not emitted after .disconnect() in parent process,https://github.com/nodejs/node/issues/19433,1,1,1,0.6937747398688461,2.272416153319644,3.886208076659822
1200,cares deprecation warnings,https://github.com/nodejs/node/issues/52464,2,2,0,1.098201115674102,0.2655715263518138,3.882785763175907
197,"Consider adding some scripting, etc. to make sure that the key used to sign a release is listed in README.md",https://github.com/nodejs/node/issues/32561,0,0,0,0.0,4.257357973990418,3.878678986995209
122,Refactor Worker and NodeMainInstance class to reuse code,https://github.com/nodejs/node/issues/29925,2,1,3,2.7519088795479236,0.23819301848049282,3.8690965092402463
1091,Node.js Application Crashes with Memory Leak on Rocky Linux 9.3 (Versions 18.19.0 and 18.18.2),https://github.com/nodejs/node/issues/51375,2,2,3,2.7526479650605213,0.23545516769336072,3.8677275838466803
1371,vm: TypeError thrown instead of ReferenceError when a Proxy is the vm context,https://github.com/nodejs/node/issues/54550,2,2,0,1.1037093725986147,0.2135523613963039,3.856776180698152
1025,github workflows needs name correction according to the job,https://github.com/nodejs/node/issues/50546,2,2,0,1.104456062922061,0.2080766598220397,3.85403832991102
769,crypto Cipher/Decipher validation issues,https://github.com/nodejs/node/issues/45189,2,2,0,1.1056439718948885,0.1998631074606434,3.849931553730322
287,doc: crypto.sign and crypto.verify string/buffer keys must be pem,https://github.com/nodejs/node/issues/35331,2,2,0,1.1078157321159035,0.1861738535249829,3.8430869267624916
1382,"Source map working in Chrome, but not in Node",https://github.com/nodejs/node/issues/54765,2,1,0,1.1078157321159035,0.1861738535249829,3.8430869267624916
1384,Unexpected behavior in process.env handling null bytes,https://github.com/nodejs/node/issues/54781,2,2,0,1.1082804511943836,0.1834360027378508,3.8417180013689256
1145,fs.readdirSync(recursive=true) should not follow follow symlinks by default,https://github.com/nodejs/node/issues/51858,2,2,0,1.1141355188132753,0.15331964407939766,3.826659822039699
222,OutgoingMessage should set writable false,https://github.com/nodejs/node/issues/33643,2,2,0,1.114741262920187,0.15058179329226556,3.8252908966461328
1217,flaky: benchmark/test-benchmark-crypto,https://github.com/nodejs/node/issues/52690,2,2,0,1.1186656809132542,0.13415468856947296,3.8170773442847366
1056,node: ../deps/uv/src/unix/linux.c:1091: uv__poll_io_uring: Assertion `uv__has_active_reqs(loop)' failed.,https://github.com/nodejs/node/issues/51011,2,2,0,1.1208279866269235,0.12594113620807665,3.8129705681040384
553,Improve error message for replacing require usage with dynamic import,https://github.com/nodejs/node/issues/40544,2,2,0,1.1215806113456799,0.12320328542094455,3.8116016427104724
454,Windows Latest LTS Version: 14.17.0 .msi installer does not clear/ upgrade existing npm version,https://github.com/nodejs/node/issues/38940,2,2,1,1.6896859727293538,0.10677618069815195,3.8033880903490758
317,"[TEST] fs: read test rejects with ""cannot be written""",https://github.com/nodejs/node/issues/36114,2,1,0,1.1310412727414678,0.09308692676249145,3.7965434633812456
1385,Add support for multiple import maps,https://github.com/nodejs/node/issues/54784,2,2,0,1.132020596256575,0.09034907597535935,3.7951745379876796
284,Dynamic import fails in DevTools inspector (invalid host defined options),https://github.com/nodejs/node/issues/35307,1,1,4,1.3572829983949541,2.0670773442847366,3.7835386721423685
1063,--dns-result-order=ipv4first not being respected for a custom .npmrc registry,https://github.com/nodejs/node/issues/51113,2,2,0,1.1431352468308227,0.06297056810403832,3.7814852840520192
990,Http2Session emits 'connect' event while socket is still connecting,https://github.com/nodejs/node/issues/49860,2,2,0,1.145683711998595,0.057494866529774126,3.778747433264887
1324,Tracking issue: Stabilizing network inspection in Node.js,https://github.com/nodejs/node/issues/53946,2,2,3,2.86751008657222,0.05475701574264202,3.777378507871321
1126,../deps/v8/src/codegen/riscv/assembler-riscv.h:289:60: error: ‘Tagged’ has not been declared,https://github.com/nodejs/node/issues/51762,2,2,0,1.1483563731541264,0.05201916495550993,3.776009582477755
533,How to replace OpenSSL 1.1.1 with gmSSL?,https://github.com/nodejs/node/issues/40185,2,2,0,1.1497417526895082,0.049281314168377825,3.774640657084189
625,Vendoring to fix HTTP import reliability concerns,https://github.com/nodejs/node/issues/41951,2,2,3,2.877903121614184,0.04654346338124572,3.773271731690623
1349,WSL/Linux memory leak when requiring a module that can't be found,https://github.com/nodejs/node/issues/54178,2,2,0,1.1511612486456735,0.04654346338124572,3.773271731690623
1269,Relative `require()` in `commonjs` source not processed by ESM Loader ,https://github.com/nodejs/node/issues/53198,2,1,0,1.1541071637176856,0.04106776180698152,3.770533880903491
326,[FR] Provide a Conan recipe,https://github.com/nodejs/node/issues/36449,2,2,0,1.155636017379526,0.038329911019849415,3.769164955509925
1420,build: configure path refactoring broke ICU download on windows,https://github.com/nodejs/node/issues/55214,2,1,0,1.155636017379526,0.038329911019849415,3.769164955509925
1464,https://github.com/nodejs/node/pull/54677 should be backported to NodeJS 20 Branch,https://github.com/nodejs/node/issues/55726,2,1,0,1.1572038650126235,0.03559206023271732,3.7677960301163584
1370,Flaky test-runner-run-watch,https://github.com/nodejs/node/issues/54534,2,1,0,1.1572038650126235,0.03559206023271732,3.7677960301163584
775,Stack buffer overflow in `deps/icu-small/source/common/uresbund.cpp:205:9`,https://github.com/nodejs/node/issues/45297,2,2,0,1.1572038650126235,0.03559206023271732,3.7677960301163584
1131,Ambiguous wording at loading order description,https://github.com/nodejs/node/issues/51780,2,2,0,1.1604621565363409,0.030116358658453114,3.7650581793292264
945,`crypto.createPrivateKey` no longer throws `TypeError` for missing passphrase,https://github.com/nodejs/node/issues/48881,2,2,1,1.7406932348045112,0.030116358658453114,3.7650581793292264
1336,RegExp Buffer,https://github.com/nodejs/node/issues/54082,2,2,0,1.16215560335935,0.02737850787132101,3.7636892539356603
1527,Node V20.15.0 Crash on Process Exiting,https://github.com/nodejs/node/issues/56245,2,2,0,1.16215560335935,0.02737850787132101,3.7636892539356603
813,Segmentation fault after to pipe  getHeapSnapshot() stream from Worker thread,https://github.com/nodejs/node/issues/46210,2,2,0,1.16215560335935,0.02737850787132101,3.7636892539356603
590,Project crashed after Worker.terminate(),https://github.com/nodejs/node/issues/41107,2,1,0,1.163894062181004,0.024640657084188913,3.7623203285420943
1332,Issue with Variable Declaration and Reference Errors in Node.js REPL and Browser Console,https://github.com/nodejs/node/issues/54055,2,2,0,1.163894062181004,0.024640657084188913,3.7623203285420943
722,Investigate console WPT failures without-intl and without-ssl,https://github.com/nodejs/node/issues/44185,2,2,0,1.163894062181004,0.024640657084188913,3.7623203285420943
749,Inconsistent validation of custom signals,https://github.com/nodejs/node/issues/44749,2,2,0,1.1656792586682296,0.02190280629705681,3.7609514031485283
412,DeprecationWarnings emitted during addon/node-api test compilation,https://github.com/nodejs/node/issues/38065,2,2,0,1.1675130213865714,0.019164955509924708,3.7595824777549622
1093,flaky: test-inspector-scriptparsed-context ,https://github.com/nodejs/node/issues/51387,2,2,0,1.1693972903558738,0.01642710472279261,3.758213552361396
852,http2.Http2Server listen conditionally leaves an open file handle after cleanup,https://github.com/nodejs/node/issues/47006,2,2,0,1.1693972903558738,0.01642710472279261,3.758213552361396
1220,Deadlock with worker threads and TLS `createSecureContext`,https://github.com/nodejs/node/issues/52698,2,2,0,1.1693972903558738,0.01642710472279261,3.758213552361396
883,deps: time zone updater workflow problems,https://github.com/nodejs/node/issues/47702,2,2,1,1.7540959355338108,0.01642710472279261,3.758213552361396
1406,Any idea when Single executable application feature will reach stable status?,https://github.com/nodejs/node/issues/55007,2,2,0,1.1693972903558738,0.01642710472279261,3.758213552361396
496,@hapi/hapi broken on master,https://github.com/nodejs/node/issues/39642,2,2,0,1.1693972903558738,0.01642710472279261,3.758213552361396
1104,[Cluster] Primary process closes socket sporadically in linux,https://github.com/nodejs/node/issues/51578,2,1,0,1.1693972903558738,0.01642710472279261,3.758213552361396
552,Negative utilization in eventLoopUtilization for worker_threads,https://github.com/nodejs/node/issues/40525,2,2,0,1.1693972903558738,0.01642710472279261,3.758213552361396
741,`--trace-uncaught` does nothing after the debugger is attached and then detached,https://github.com/nodejs/node/issues/44544,2,2,0,1.1693972903558738,0.01642710472279261,3.758213552361396
1479,"Unexpected behavior in module customization hooks / loader, for `require`",https://github.com/nodejs/node/issues/55808,2,2,0,1.171334126531983,0.013689253935660506,3.75684462696783
1335,Debugger docs: the expired parts ⚰🧹,https://github.com/nodejs/node/issues/54078,2,2,0,1.171334126531983,0.013689253935660506,3.75684462696783
1055,Node.js doesn't properly implement %d %i %s console.log() format specifiers,https://github.com/nodejs/node/issues/51006,2,2,4,3.5199771670177435,0.010951403148528405,3.755475701574264
1551,vm.compileFunction results in an abort,https://github.com/nodejs/node/issues/56366,2,2,0,1.1733257223392477,0.010951403148528405,3.755475701574264
924,Prevent double buffering when converting Readable to ReadableStream,https://github.com/nodejs/node/issues/48636,2,2,0,1.1733257223392477,0.010951403148528405,3.755475701574264
729,"Finally I can solve this problem OpenSSL configuration error: When I will install vue CLI by use command ""npm install -g @vue/cli""",https://github.com/nodejs/node/issues/44289,2,2,0,1.1753744133989112,0.008213552361396304,3.754106776180698
1521,`--run` CLI argument fails for path name with an umlaut character on windows,https://github.com/nodejs/node/issues/56168,2,2,0,1.1753744133989112,0.008213552361396304,3.754106776180698
599,unhandledRejection unconditionally prevents uncaughtExceptionMonitor,https://github.com/nodejs/node/issues/41222,2,2,0,1.1753744133989112,0.008213552361396304,3.754106776180698
231,Provide a way to dynamically change loader hook,https://github.com/nodejs/node/issues/33903,2,2,2,2.3507488267978225,0.008213552361396304,3.754106776180698
1533,mksnapshot bus error on mips64el,https://github.com/nodejs/node/issues/56270,2,1,0,1.1753744133989112,0.008213552361396304,3.754106776180698
557,doc: module.createRequire() not descriptive,https://github.com/nodejs/node/issues/40567,2,2,0,1.1774826916226846,0.0054757015742642025,3.752737850787132
1121,CompressionStream hangs,https://github.com/nodejs/node/issues/51728,2,2,0,1.1774826916226846,0.0054757015742642025,3.752737850787132
732,Debug build broken on v18.8.0,https://github.com/nodejs/node/issues/44371,2,2,0,1.1774826916226846,0.0054757015742642025,3.752737850787132
526,"doc: Different information about when functions have been ""Added"" are confusing",https://github.com/nodejs/node/issues/40037,2,2,0,1.1774826916226846,0.0054757015742642025,3.752737850787132
726,`fs.copyFile` fails if source is readonly and target is a WSL volume,https://github.com/nodejs/node/issues/44261,2,2,0,1.1774826916226846,0.0054757015742642025,3.752737850787132
320,The `sensitiveHeaders` HTTP2 symbol should be initialized via `Symbol.for` instead,https://github.com/nodejs/node/issues/36282,2,2,0,1.1796532198697784,0.0027378507871321013,3.751368925393566
1042,Can not re-connect TLS when using PKCS #11,https://github.com/nodejs/node/issues/50851,2,1,0,1.1796532198697784,0.0027378507871321013,3.751368925393566
920,[Node 20] ESM Loaders no longer have `process.argv` access,https://github.com/nodejs/node/issues/48577,2,2,3,2.949133049674446,0.0027378507871321013,3.751368925393566
1424,Accepting `CryptoKey` in `node:crypto` APIs,https://github.com/nodejs/node/issues/55293,2,1,1,1.7694798298046677,0.0027378507871321013,3.751368925393566
663,arm64 cross-compile fails on amd64,https://github.com/nodejs/node/issues/42643,2,2,0,1.1796532198697784,0.0027378507871321013,3.751368925393566
1431,"Add lastChunkHandling (""loose"", ""strict"", or ""stop-before-partial"") to base64 decoding",https://github.com/nodejs/node/issues/55360,2,2,0,1.1796532198697784,0.0027378507871321013,3.751368925393566
1393,`test-sqlite-statement-sync` is flaky,https://github.com/nodejs/node/issues/54810,2,2,0,1.1796532198697784,0.0027378507871321013,3.751368925393566
1213,Cross-compilation bug when compiling for ARM64 on a non-ARM64 host with Windows,https://github.com/nodejs/node/issues/52664,2,2,0,1.1796532198697784,0.0027378507871321013,3.751368925393566
1292,Missing documentation for process.traceProcessWarnings,https://github.com/nodejs/node/issues/53514,2,2,0,1.1796532198697784,0.0027378507871321013,3.751368925393566
855,Memory overflow in `Readable.toWeb` due to the default strategy,https://github.com/nodejs/node/issues/47128,2,1,1,1.7694798298046677,0.0027378507871321013,3.751368925393566
730,"Mass eval() of unique functions causes slowdown and halts, later on in program execution",https://github.com/nodejs/node/issues/44310,2,2,0,1.1796532198697784,0.0027378507871321013,3.751368925393566
1558,CJS nextLoader callback in loader hook doesn't use changed URL,https://github.com/nodejs/node/issues/56376,2,2,0,1.1796532198697784,0.0027378507871321013,3.751368925393566
162,Ability to synchronously drain a thread safe function,https://github.com/nodejs/node/issues/31531,2,2,0,1.1796532198697784,0.0027378507871321013,3.751368925393566
465,[bug] v16.3.0 - https server request.socket.destroy() vs ._parent.destroy() inconsistency,https://github.com/nodejs/node/issues/39046,2,1,0,1.1796532198697784,0.0027378507871321013,3.751368925393566
580,doc: What is the spec regarding Package exports target fallbacks,https://github.com/nodejs/node/issues/40896,2,2,0,1.1796532198697784,0.0027378507871321013,3.751368925393566
1415,Streams: finished Change in behavoir between 22.2.0 and 22.9.0. Throws Exception (Unhandled Rejection),https://github.com/nodejs/node/issues/55152,2,1,0,1.181888848400501,0.0,3.75
1237,Nodejs process crashed when using `console` to print some object. TypeError: Cannot read properties of undefined (reading 'reloadNavigation'),https://github.com/nodejs/node/issues/52887,2,2,1,1.7728332726007514,0.0,3.75
351,"make `options.flag[s]` consistent across fs.open, fs.writeFile, fs.appendFile, fs.readFile",https://github.com/nodejs/node/issues/37004,2,2,0,1.181888848400501,0.0,3.75
923,100% CPU usage for a long time after execution of the last statement,https://github.com/nodejs/node/issues/48581,2,1,0,1.181888848400501,0.0,3.75
604,Garbage Collection performance events have startTime values that aren't consistent with earlier versions.,https://github.com/nodejs/node/issues/41382,2,2,0,1.181888848400501,0.0,3.75
1277,Customization hooks / ESM loaders reports importing JSON warning on commonjs modules,https://github.com/nodejs/node/issues/53318,2,2,0,1.181888848400501,0.0,3.75
479,Wrong sort return with Intl.Collator,https://github.com/nodejs/node/issues/39318,2,1,0,1.181888848400501,0.0,3.75
909,net.Server's getConnections incorrectly reports connection count for clustered servers,https://github.com/nodejs/node/issues/48333,2,1,1,1.7728332726007514,0.0,3.75
1238,Verify that `npm` is runnable in tests,https://github.com/nodejs/node/issues/52891,2,2,0,1.181888848400501,0.0,3.75
762,[test] riscv64 failure in parallel/test-crypto-sign-verify,https://github.com/nodejs/node/issues/45065,2,2,0,1.181888848400501,0.0,3.75
1268,Lambdas in node 18.x (18.20.3) and problems with axios HPE_INVALID_HEADER_TOKEN,https://github.com/nodejs/node/issues/53196,2,2,1,1.7728332726007514,0.0,3.75
600,doc: `process.moduleLoadList` not documented,https://github.com/nodejs/node/issues/41233,2,2,1,1.7728332726007514,0.0,3.75
1057,"Under Windows, spawning a `pwsh` child process using `spawn` and `detached: true` does not work",https://github.com/nodejs/node/issues/51018,2,1,0,1.181888848400501,0.0,3.75
548,piping request to fs write stream consume 100% CPU,https://github.com/nodejs/node/issues/40480,2,2,1,1.7728332726007514,0.0,3.75
211,constants: stop exporting UV_ constants,https://github.com/nodejs/node/issues/33273,2,2,0,1.181888848400501,0.0,3.75
1232,tiny startup time regression,https://github.com/nodejs/node/issues/52804,2,2,1,1.7728332726007514,0.0,3.75
1503,Unix Domain Socket doesn't support on Windows,https://github.com/nodejs/node/issues/55979,2,2,1,1.7728332726007514,0.0,3.75
1058,The invalid cwd path is not reported correctly.,https://github.com/nodejs/node/issues/51054,2,2,0,1.181888848400501,0.0,3.75
467,child process hangs indefinitely,https://github.com/nodejs/node/issues/39072,2,2,0,1.181888848400501,0.0,3.75
713,HTTP status code 102 not processed when using proxy,https://github.com/nodejs/node/issues/43944,2,2,0,1.181888848400501,0.0,3.75
1224,Compiler error running on Node 20.12 (works in 20.11.6) in napi-intl.h when calling napi_status napi_create_external_buffer,https://github.com/nodejs/node/issues/52754,2,2,0,1.181888848400501,0.0,3.75
611,Major discrepancy in FS constants between the docs and distribution,https://github.com/nodejs/node/issues/41590,2,2,0,1.181888848400501,0.0,3.75
1468,ServerHttp2Stream: Error: This is caused by either a bug in Node.js or incorrect usage of Node.js internals.,https://github.com/nodejs/node/issues/55760,2,2,0,1.181888848400501,0.0,3.75
1493,Fetch sends incorrect number of chunks when given a ReadableStream with a Passthrough as body,https://github.com/nodejs/node/issues/55910,2,1,0,1.181888848400501,0.0,3.75
419,"if uncaughtExceptionMonitor handler throws asynchronously, the process enters infinite async recursion",https://github.com/nodejs/node/issues/38281,2,2,0,1.181888848400501,0.0,3.75
1280,Are primordials safe from monkeypatching the [Symbol.species] method?,https://github.com/nodejs/node/issues/53377,2,2,0,1.181888848400501,0.0,3.75
1310,Adding --trace-sigint for tests that are timing out in tools/test.py?,https://github.com/nodejs/node/issues/53739,2,2,1,1.7728332726007514,0.0,3.75
1447,"When using microtaskMode: 'afterEvaluate', the program gets stuck in the vm and cannot return to the main program.",https://github.com/nodejs/node/issues/55546,2,2,0,1.181888848400501,0.0,3.75
796,[Documentation 16 LTS] Zlib,https://github.com/nodejs/node/issues/45782,2,2,0,1.181888848400501,0.0,3.75
513,V8 (9.5) has split the `v8.h` header,https://github.com/nodejs/node/issues/39876,2,2,0,1.181888848400501,0.0,3.75
583,`ERR_UNSUPPORTED_DIR_IMPORT` has hard to parse Grammar,https://github.com/nodejs/node/issues/40973,2,2,0,1.181888848400501,0.0,3.75
778,Node.js API v18.x does not mark 18 LTS but does mark 12 LTS,https://github.com/nodejs/node/issues/45316,2,2,0,1.181888848400501,0.0,3.75
679,test-process-uid-gid failures in ASAN GitHub Actions builds,https://github.com/nodejs/node/issues/43082,2,1,3,2.954722121001253,0.0,3.75
1329,CI runs on fork keep failing,https://github.com/nodejs/node/issues/54026,2,2,0,1.181888848400501,0.0,3.75
1474,shared-libuv still requires deps/uv/uv.gyp,https://github.com/nodejs/node/issues/55787,2,2,0,1.181888848400501,0.0,3.75
1337,Providing a custom representation for an ES module under require(esm),https://github.com/nodejs/node/issues/54085,2,1,0,1.181888848400501,0.0,3.75
256,domain: should variable domain in EventEmitter be private,https://github.com/nodejs/node/issues/34720,2,1,1,1.7728332726007514,0.0,3.75
786,Error building nodeJS + FIPS (static linking) on Windows 10,https://github.com/nodejs/node/issues/45465,2,2,0,1.181888848400501,0.0,3.75
968,node_http_parser.cc:1096:static void node::{anonymous}::ConnectionsList::Expired with NodeJS v18.17.0,https://github.com/nodejs/node/issues/49324,2,2,0,1.181888848400501,0.0,3.75
395,once event leak when forwarding events,https://github.com/nodejs/node/issues/37828,2,2,0,1.181888848400501,0.0,3.75
935,"""...\\"" breaks package.json parsing",https://github.com/nodejs/node/issues/48745,2,2,0,1.181888848400501,0.0,3.75
509,DNS server set to 0.0.0.0 causes lookups to time out,https://github.com/nodejs/node/issues/39795,2,2,0,1.181888848400501,0.0,3.75
1017,Discussion: Missing use cases with module customization hooks,https://github.com/nodejs/node/issues/50392,2,2,1,1.7728332726007514,0.0,3.75
682,"node:repl docs code not working (under ""Starting multiple REPL instances against a single running instance"")",https://github.com/nodejs/node/issues/43118,2,2,0,1.181888848400501,0.0,3.75
1394,`parallel.test-macos-app-sandbox` is flaky,https://github.com/nodejs/node/issues/54811,2,2,0,1.181888848400501,0.0,3.75
426,TCP_KEEPIDLE value set by socket.setKeepAlive() is ignored on first keepalive probe,https://github.com/nodejs/node/issues/38445,2,2,0,1.181888848400501,0.0,3.75
1298,Behavior of `realpath` with an empty string argument,https://github.com/nodejs/node/issues/53635,2,2,0,1.181888848400501,0.0,3.75
1514,"After updating to v22.12, always got ReferenceError: require is not defined in tailwind config",https://github.com/nodejs/node/issues/56140,2,2,1,1.7728332726007514,0.0,3.75
724,Implement OpenSSL MDC2,https://github.com/nodejs/node/issues/44221,2,2,0,1.181888848400501,0.0,3.75
114,doc: how to document multiple inheritance,https://github.com/nodejs/node/issues/29368,1,1,0,0.44638910093726103,1.943874058863792,3.721937029431896
677,Nodejs fails to install due to Calling SRSetRestorePoint API on latest insider build 22616.100,https://github.com/nodejs/node/issues/43076,1,1,0,0.4336096444831366,1.68104038329911,3.590520191649555
263,Syntax error not showing in stderr with `node --inspect-brk` in node 12+,https://github.com/nodejs/node/issues/41792,1,1,0,0.4230429227711208,1.45927446954141,3.479637234770705
